<?xml version="1.0" encoding="UTF-8"?>
<xs:schema xmlns:xs="http://www.w3.org/2001/XMLSchema">
    <xs:element name="enciclopedia">
        <xs:complexType>
            <xs:sequence>
                <xs:element name="persona" maxOccurs="unbounded">
                    <xs:complexType>
                        <xs:sequence>
                            <xs:element name="nom" type="xs:string"/>
                            <xs:element name="cognom" type="xs:string"/>
                            <xs:element name="publicacio" type="xs:string" minOccurs="1" maxOccurs="unbounded"/>
                        </xs:sequence>
                        <xs:attribute name="datanaixement" type="xs:date"/>
                        <xs:attribute name="sexe">
                            <xs:simpleType>
                                <xs:restriction base="xs:string">
                                    <xs:enumeration value="H"/>
                                    <xs:enumeration value="D"/>
                                    <xs:enumeration value="I"/>
                                </xs:restriction>
                            </xs:simpleType>
                        </xs:attribute>
                    </xs:complexType>
                </xs:element>
            </xs:sequence>
        </xs:complexType>
    </xs:element>
</xs:schema>
